<?xml version="1.0" encoding="UTF-8"?>
<Cellar xmlns="http://example.org/ns/winestock/"
 xmlns:xsi="http://www.w3.org/2001/XMLSchema-instance"
 xsi:schemaLocation="http://example.org/ns/winestock/ file:/home/kelly/github/pwims/xml-schemas/winestock.xsd">
    <CellarInformation>
        <cellarLocation>
            <LocationName>LocationName0</LocationName>
            <GeoNamesLocation>
                <geonameid>0</geonameid>
                <name>name0</name>
            </GeoNamesLocation>
        </cellarLocation>
        <Owner>0</Owner>
        <Owner>0</Owner>
    </CellarInformation>
    <WineBottle>
        <Producer>
            <ProducerName>ProducerName0</ProducerName>
            <ProducerLocation>
                <LocationName>LocationName1</LocationName>
                <GeoNamesLocation>
                    <geonameid>0</geonameid>
                    <name>name1</name>
                </GeoNamesLocation>
                <Appellation>
                    <AppellationName>AppellationName0</AppellationName>
                    <AppellationAuthority>
                        <AuthorityName>AuthorityName0</AuthorityName>
                        <Jurisdiction>Jurisdiction0</Jurisdiction>
                        <SourceDoc>SourceDoc0</SourceDoc>
                    </AppellationAuthority>
                </Appellation>
            </ProducerLocation>
            <ProducerStatus>ACTIVE</ProducerStatus>
        </Producer>
        <Name>Name0</Name>
        <Vintage>2006</Vintage>
        <KnownVarietal Portion="0" varietalID="ID001">
            <VarietalName>VarietalName0</VarietalName>
            <VarietalOrigin>
                <LocationName>LocationName2</LocationName>
                <GeoNamesLocation>
                    <geonameid>0</geonameid>
                    <name>name2</name>
                </GeoNamesLocation>
                <Appellation>
                    <AppellationName>AppellationName1</AppellationName>
                    <AppellationAuthority>
                        <AuthorityName>AuthorityName1</AuthorityName>
                        <Jurisdiction>Jurisdiction1</Jurisdiction>
                        <SourceDoc>SourceDoc1</SourceDoc>
                    </AppellationAuthority>
                </Appellation>
                <Vineyard>
                    <VineyardLocation>
                        <LocationName>LocationName3</LocationName>
                        <GeoNamesLocation>
                            <geonameid>0</geonameid>
                            <name>name3</name>
                        </GeoNamesLocation>
                        <Appellation>
                            <AppellationName>AppellationName2</AppellationName>
                            <AppellationAuthority>
                                <AuthorityName>AuthorityName2</AuthorityName>
                                <Jurisdiction>Jurisdiction2</Jurisdiction>
                                <SourceDoc>SourceDoc2</SourceDoc>
                            </AppellationAuthority>
                        </Appellation>
                    </VineyardLocation>
                    <DatePlanted>2006-05-04</DatePlanted>
                    <SoilDescription>SoilDescription0</SoilDescription>
                    <Exposure>Exposure0</Exposure>
                    <OtherNotes>OtherNotes0</OtherNotes>
                </Vineyard>
            </VarietalOrigin>
            <VarietalNotes>VarietalNotes0</VarietalNotes>
        </KnownVarietal>
        <KnownVarietal Portion="0" varietalID="ID003">
            <VarietalName>VarietalName1</VarietalName>
            <VarietalOrigin>
                <LocationName>LocationName4</LocationName>
                <GeoNamesLocation>
                    <geonameid>0</geonameid>
                    <name>name4</name>
                </GeoNamesLocation>
                <Appellation>
                    <AppellationName>AppellationName3</AppellationName>
                    <AppellationAuthority>
                        <AuthorityName>AuthorityName3</AuthorityName>
                        <Jurisdiction>Jurisdiction3</Jurisdiction>
                        <SourceDoc>SourceDoc3</SourceDoc>
                    </AppellationAuthority>
                </Appellation>
                <Vineyard>
                    <VineyardLocation>
                        <LocationName>LocationName5</LocationName>
                        <GeoNamesLocation>
                            <geonameid>0</geonameid>
                            <name>name5</name>
                        </GeoNamesLocation>
                        <Appellation>
                            <AppellationName>AppellationName4</AppellationName>
                            <AppellationAuthority>
                                <AuthorityName>AuthorityName4</AuthorityName>
                                <Jurisdiction>Jurisdiction4</Jurisdiction>
                                <SourceDoc>SourceDoc4</SourceDoc>
                            </AppellationAuthority>
                        </Appellation>
                    </VineyardLocation>
                    <DatePlanted>2006-05-04</DatePlanted>
                    <SoilDescription>SoilDescription1</SoilDescription>
                    <Exposure>Exposure1</Exposure>
                    <OtherNotes>OtherNotes1</OtherNotes>
                </Vineyard>
            </VarietalOrigin>
            <VarietalNotes>VarietalNotes1</VarietalNotes>
        </KnownVarietal>
        <Type>Red</Type>
        <Type>Red</Type>
        <SeriesMembership>SeriesMembership0</SeriesMembership>
        <ProductionSpecs>
            <AgingSpecs>AgingSpecs0</AgingSpecs>
            <QuantityProduced>
                <Quantity unitType="bottles">50</Quantity>
                <DisplayQuantity>DisplayQuantity0</DisplayQuantity>
            </QuantityProduced>
            <WineMakerNotes>WineMakerNotes0</WineMakerNotes>
        </ProductionSpecs>
        <InstrumentMetrics>
            <Alcohol>Alcohol0</Alcohol>
            <ResidualSugar>ResidualSugar0</ResidualSugar>
            <TannicAcid>TannicAcid0</TannicAcid>
            <pH>pH0</pH>
        </InstrumentMetrics>
        <WineMaker>
            <WineMakerName>WineMakerName0</WineMakerName>
            <WineMakerStatus>ACTIVE</WineMakerStatus>
            <AssociatedProducers>
                <ProducerName>ProducerName1</ProducerName>
                <ProducerLocation>
                    <LocationName>LocationName6</LocationName>
                    <GeoNamesLocation>
                        <geonameid>0</geonameid>
                        <name>name6</name>
                    </GeoNamesLocation>
                    <Appellation>
                        <AppellationName>AppellationName5</AppellationName>
                        <AppellationAuthority>
                            <AuthorityName>AuthorityName5</AuthorityName>
                            <Jurisdiction>Jurisdiction5</Jurisdiction>
                            <SourceDoc>SourceDoc5</SourceDoc>
                        </AppellationAuthority>
                    </Appellation>
                </ProducerLocation>
                <ProducerStatus>ACTIVE</ProducerStatus>
            </AssociatedProducers>
            <AssociatedProducers>
                <ProducerName>ProducerName2</ProducerName>
                <ProducerLocation>
                    <LocationName>LocationName7</LocationName>
                    <GeoNamesLocation>
                        <geonameid>0</geonameid>
                        <name>name7</name>
                    </GeoNamesLocation>
                    <Appellation>
                        <AppellationName>AppellationName6</AppellationName>
                        <AppellationAuthority>
                            <AuthorityName>AuthorityName6</AuthorityName>
                            <Jurisdiction>Jurisdiction6</Jurisdiction>
                            <SourceDoc>SourceDoc6</SourceDoc>
                        </AppellationAuthority>
                    </Appellation>
                </ProducerLocation>
                <ProducerStatus>ACTIVE</ProducerStatus>
            </AssociatedProducers>
        </WineMaker>
        <WineMaker>
            <WineMakerName>WineMakerName1</WineMakerName>
            <WineMakerStatus>ACTIVE</WineMakerStatus>
            <AssociatedProducers>
                <ProducerName>ProducerName3</ProducerName>
                <ProducerLocation>
                    <LocationName>LocationName8</LocationName>
                    <GeoNamesLocation>
                        <geonameid>0</geonameid>
                        <name>name8</name>
                    </GeoNamesLocation>
                    <Appellation>
                        <AppellationName>AppellationName7</AppellationName>
                        <AppellationAuthority>
                            <AuthorityName>AuthorityName7</AuthorityName>
                            <Jurisdiction>Jurisdiction7</Jurisdiction>
                            <SourceDoc>SourceDoc7</SourceDoc>
                        </AppellationAuthority>
                    </Appellation>
                </ProducerLocation>
                <ProducerStatus>ACTIVE</ProducerStatus>
            </AssociatedProducers>
            <AssociatedProducers>
                <ProducerName>ProducerName4</ProducerName>
                <ProducerLocation>
                    <LocationName>LocationName9</LocationName>
                    <GeoNamesLocation>
                        <geonameid>0</geonameid>
                        <name>name9</name>
                    </GeoNamesLocation>
                    <Appellation>
                        <AppellationName>AppellationName8</AppellationName>
                        <AppellationAuthority>
                            <AuthorityName>AuthorityName8</AuthorityName>
                            <Jurisdiction>Jurisdiction8</Jurisdiction>
                            <SourceDoc>SourceDoc8</SourceDoc>